{
  "arch_snapshot": "2026/09/24",
  "architecture": "x86_64",
  "base_image_digest": "sha256:8745817f349ed24373341ddb92776209eeec3f0364ea48f7f645ac5800d30a50",
  "kind": "kitpro-phase6-worker-lock",
  "manifest_sha256": "8274ecbcec3117f01326ffbb74a92817cd0ff345181ada8ab7be4c91220b9a05",
  "package_count": 437,
  "packages": [
    {
      "archive_filename": "acl-2.4.0-1-x86_64.pkg.tar.zst",
      "archive_sha256": "dca9ec50cf51243b86a67367a55e78b1851d31240b1edaf9c011f8511765d999",
      "installed_metadata_sha256": "d3428b8106b45eafb7abfcddab2c974f0711b5f59ea388dc26c248c459f352a9",
      "name": "acl",
      "version": "2.4.0-1"
    },
    {
      "archive_filename": "adwaita-cursors-50.0-1-any.pkg.tar.zst",
      "archive_sha256": "e74145387e2c0b2660f93de09a4994473229fb29b0924a7413cc5e2d535261b6",
      "installed_metadata_sha256": "fda5920e579668b254725f5c17d6de3bc64f1ce0e4a715227d4383f034e17a68",
      "name": "adwaita-cursors",
      "version": "50.0-1"
    },
    {
      "archive_filename": "adwaita-fonts-51.0-2-any.pkg.tar.zst",
      "archive_sha256": "f27dd3b4700ef61bed117a6106013b7181ee9348ba038784ccfe5091ef172e4d",
      "installed_metadata_sha256": "acb9f8bdf82dbfb119a4526737bdc9c20b5e2b17da3fe8bbf1196f0d6a644bd0",
      "name": "adwaita-fonts",
      "version": "51.0-2"
    },
    {
      "archive_filename": "adwaita-icon-theme-50.0-1-any.pkg.tar.zst",
      "archive_sha256": "192223d774c89c353932e954061013a3e53c129f80b64bc3cbca0e098000123c",
      "installed_metadata_sha256": "ceb42a5f86a58e7c885178edd98defd0a7b83e32ca1bbb95d94cfaecd49d604d",
      "name": "adwaita-icon-theme",
      "version": "50.0-1"
    },
    {
      "archive_filename": "adwaita-icon-theme-legacy-46.2-3-any.pkg.tar.zst",
      "archive_sha256": "c14690d14e1d8a67e6b5570a2b28a2da6de4ebeb592a629b2a70e41411bafc5a",
      "installed_metadata_sha256": "33f87a0f1c1c05779f78265fa8844143590d8c763afd8e4e5139a370ddd28f3d",
      "name": "adwaita-icon-theme-legacy",
      "version": "46.2-3"
    },
    {
      "archive_filename": "alsa-lib-1.2.16.1-1-x86_64.pkg.tar.zst",
      "archive_sha256": "2d2f2b3966cebd6ec75abbbdb4709a1093849207ada6624cdfe36f38d0f5c811",
      "installed_metadata_sha256": "5dfdec22132fa45d2c2b1c9546193075859efd36dbd811081b3c62fca4e77c4e",
      "name": "alsa-lib",
      "version": "1.2.16.1-1"
    },
    {
      "archive_filename": "alsa-topology-conf-1.2.5.1-4-any.pkg.tar.zst",
      "archive_sha256": "a76b237e24973099b3cee9d3c89f4f8b46d9133411f0992bd46a5131e4427a0c",
      "installed_metadata_sha256": "a0247946d50bd9bce9534fa961e7c92f0dd0e222b7082d362c8f98161db0d8ed",
      "name": "alsa-topology-conf",
      "version": "1.2.5.1-4"
    },
    {
      "archive_filename": "alsa-ucm-conf-1.2.16.1-1-any.pkg.tar.zst",
      "archive_sha256": "73e3a6cf819dfcedf884616c18d2206dea77e98311717dca8135256fabe55fbc",
      "installed_metadata_sha256": "f70bce2a5b8f3925eb6ba0c5f0d4d511fc9708a14464cbcae6b31d4b2a333707",
      "name": "alsa-ucm-conf",
      "version": "1.2.16.1-1"
    },
    {
      "archive_filename": "aom-3.15.1-1-x86_64.pkg.tar.zst",
      "archive_sha256": "1356b16c0311b7dff787668f6021ed47a2774dc67dda65d2bb3458850e90b650",
      "installed_metadata_sha256": "f9b04b7524308edd42c3930006e561816c0aaaa1548b4d5a92ace2f1271caebb",
      "name": "aom",
      "version": "3.15.1-1"
    },
    {
      "archive_filename": "arch-install-scripts-31-2-any.pkg.tar.zst",
      "archive_sha256": "21844567f7811bb957cb57982c697ff6a466a13ea3c8ad2cd159a7603c83608e",
      "installed_metadata_sha256": "c00165bef2a73af2dbc111da39b59b8740401844ae0440f8a0d76a5c56b0e764",
      "name": "arch-install-scripts",
      "version": "31-2"
    },
    {
      "archive_filename": "archiso-90-1-any.pkg.tar.zst",
      "archive_sha256": "eb98536e4a440927fabc6fc635d3f91f1f26d9453e6277836b8397857d673ece",
      "installed_metadata_sha256": "22c95acd3f33261cb7d8f339e5aec936effcc1224f845bf40457f4e676e20667",
      "name": "archiso",
      "version": "90-1"
    },
    {
      "archive_filename": "archlinux-keyring-20260909-1-any.pkg.tar.zst",
      "archive_sha256": "6a8ea16f51d3b305c18322d5884ca959f12c32a3f186873090fdc18465605293",
      "installed_metadata_sha256": "3998bc0cbdd9b607854853aa86356e62b7988774cc246bb5b9f1aeaf6d594a69",
      "name": "archlinux-keyring",
      "version": "20260909-1"
    },
    {
      "archive_filename": "at-spi2-core-2.60.7-1-x86_64.pkg.tar.zst",
      "archive_sha256": "96573d039cd7de253e66c4b2f3aac99053449397358bcfbe93aa121b5417494c",
      "installed_metadata_sha256": "61458765e3a0aaec23453740855e4fab572ca109d219feb11dc4a7efa59a0918",
      "name": "at-spi2-core",
      "version": "2.60.7-1"
    },
    {
      "archive_filename": "attr-2.6.0-1-x86_64.pkg.tar.zst",
      "archive_sha256": "0db32b421f67000950f7b55b531291ce8c13985c5444425b22dce94d485daed1",
      "installed_metadata_sha256": "88e86d9b0bb7290a5bf945d486d0b4c6658ecd6d18f4f4c13e0f2dce30f3cfd8",
      "name": "attr",
      "version": "2.6.0-1"
    },
    {
      "archive_filename": "audit-4.2.1-1-x86_64.pkg.tar.zst",
      "archive_sha256": "6b2f7e400336d05bf9a4b1b65015e4a7ac3a3842fbc67790913f9748513b964e",
      "installed_metadata_sha256": "208e7d72d1b7aacbef7049f875494e4e4d957d8260a64be4d099c90ccfb550c8",
      "name": "audit",
      "version": "4.2.1-1"
    },
    {
      "archive_filename": "autoconf-2.73-1-any.pkg.tar.zst",
      "archive_sha256": "70be528019e04291fe52125c59121a99a3d39da8f1b89826f323ab81a92f492e",
      "installed_metadata_sha256": "1687ff255443c1fef19be70e771443729a74fe691edc99e1179cfcb68525f016",
      "name": "autoconf",
      "version": "2.73-1"
    },
    {
      "archive_filename": "automake-1.18.1-1-any.pkg.tar.zst",
      "archive_sha256": "47416f72d0d579b391f9be5a55f5b3fa204a09097512b8179d6be5fa0527510a",
      "installed_metadata_sha256": "895d8180b9d26202f50144a831e62cb214cff4bb959ce5e6675498b819d1cc8f",
      "name": "automake",
      "version": "1.18.1-1"
    },
    {
      "archive_filename": "avahi-1:0.9rc5-1-x86_64.pkg.tar.zst",
      "archive_sha256": "21e53fd19a25014c3242f7b43f538dd6033844692a863ace96a122e01eabf74b",
      "installed_metadata_sha256": "2cbfcb9e70d9ea08bd377e2e21f692e3abfbbfb88fbfa23e29a2e14f7015cd78",
      "name": "avahi",
      "version": "1:0.9rc5-1"
    },
    {
      "archive_filename": "base-3-3-any.pkg.tar.zst",
      "archive_sha256": "e144d83f03b1a003d31bf9c83990bfe0a503bb7bd8721dee88d72c74606acd37",
      "installed_metadata_sha256": "e31302ce5093955bf3e9431c774013bfc2592f124a1525f31a7a8597ce63697b",
      "name": "base",
      "version": "3-3"
    },
    {
      "archive_filename": "base-devel-1-2-any.pkg.tar.zst",
      "archive_sha256": "412a2effe23751e1c11b2fa68155f1a29ecea5d9dc8ea8cef4e87b7b429d3201",
      "installed_metadata_sha256": "f65a97276ad97964cb0e2421863df15f5d8eb5746f1ceab9dada46e6f2eca344",
      "name": "base-devel",
      "version": "1-2"
    },
    {
      "archive_filename": "bash-5.3.20-1-x86_64.pkg.tar.zst",
      "archive_sha256": "73a67dc509ed4a6dd64e4c7eca2895643f48083940f49431782ce78c4d4619e1",
      "installed_metadata_sha256": "00ae5b7586cfb1de3817134c7f11faee55b5bdd83b51fcfdac8edbfb8202e888",
      "name": "bash",
      "version": "5.3.20-1"
    },
    {
      "archive_filename": "binutils-2.47-4-x86_64.pkg.tar.zst",
      "archive_sha256": "d9508ad848fd6c31473ac0925cf8c3ec0d2a71bbbb5c7e39274186338a285660",
      "installed_metadata_sha256": "9518eb3ba4c00fa1c23da9734eb3314188954ea4490fb680295ee853519460c2",
      "name": "binutils",
      "version": "2.47-4"
    },
    {
      "archive_filename": "bison-3.8.2-8-x86_64.pkg.tar.zst",
      "archive_sha256": "417f8e94f7088e6de69cd36d7927d82988266f298e8d4fed3166abb13e971941",
      "installed_metadata_sha256": "c4c44c965b4f75d2c41288f6b56166b8ae815f269395cfe285786f9f25c134d7",
      "name": "bison",
      "version": "3.8.2-8"
    },
    {
      "archive_filename": "boost-libs-1.92.0-1-x86_64.pkg.tar.zst",
      "archive_sha256": "4b1392e578e46c1b23910d1c26956927d7e986d6afd5090be59045afb3c04f8d",
      "installed_metadata_sha256": "8e5f73bd2405b0d20276bd41550b156854da1748d1684cfcbad74cb102aceca4",
      "name": "boost-libs",
      "version": "1.92.0-1"
    },
    {
      "archive_filename": "brotli-1.2.0-1-x86_64.pkg.tar.zst",
      "archive_sha256": "4a0c95d5967476d0efdaf76d344b61e3eee02cd7920a315e457f3fd96311b7ec",
      "installed_metadata_sha256": "a559385d8c97f06df818d4b674923d6ccee05328a1ff5577be719682bb9966bb",
      "name": "brotli",
      "version": "1.2.0-1"
    },
    {
      "archive_filename": "bubblewrap-0.13.0-1-x86_64.pkg.tar.zst",
      "archive_sha256": "f9c03933d561a10eccd712a881c59b17b69f6accf734208cdc58574b21e2108b",
      "installed_metadata_sha256": "fe912d605ae7ff5105eee416f248c3c4e628b24f9fa7813f4dfdcebf05764d0e",
      "name": "bubblewrap",
      "version": "0.13.0-1"
    },
    {
      "archive_filename": "bzip2-1.0.8-6-x86_64.pkg.tar.zst",
      "archive_sha256": "8779003d659c441b952095c19907603a738c1366f25cc51be3fd139fa4e95748",
      "installed_metadata_sha256": "cc8ac8c9a2fcc656e95a278ea4ba21a0c6dca883bef982d0329b178f05c0dee5",
      "name": "bzip2",
      "version": "1.0.8-6"
    },
    {
      "archive_filename": "ca-certificates-20240618-1-any.pkg.tar.zst",
      "archive_sha256": "982005bd5ecc998c05f561b57bb58b4457407779727e3c3d59e926d34a8b0712",
      "installed_metadata_sha256": "bfabaa9ed112658175c91d2fa47d2207faa585d12766cf90d240e2d4bdabbc75",
      "name": "ca-certificates",
      "version": "20240618-1"
    },
    {
      "archive_filename": "ca-certificates-mozilla-3.129-1-x86_64.pkg.tar.zst",
      "archive_sha256": "74bf1959555f8b92dd01133796361c7200fa4fba066be312a5498f5a8f17be01",
      "installed_metadata_sha256": "4a64401fad52c9fafedfa9884ab68ce8598786dfb7af477699a996c9302a2c95",
      "name": "ca-certificates-mozilla",
      "version": "3.129-1"
    },
    {
      "archive_filename": "ca-certificates-utils-20240618-1-any.pkg.tar.zst",